{
  "Version": "v3.0.3",
  "Verbose": false,
  "Format": "",
  "Debug": false,
  "IgnoreDefaults": false,
  "SpacesAfterTabs": false,
  "NoColor": false,
  "Exclude": [],
  "AllowedContentTypes": [],
  "PassedFiles": [],
  "Disable": {
    "Charset": false,
    "EndOfLine": false,
    "Indentation": false,
    "InsertFinalNewline": false,
    "TrimTrailingWhitespace": false,
    "IndentSize": false,
    "MaxLineLength": false
  }
}