{
  "Version": "v0.0.1",
  "Verbose": false,
  "Debug": false,
  "IgnoreDefaults": false,
  "SpacesAfterTabs": false,
  "NoColor": false,
  "Exclude": [],
  "AllowedContentTypes": [],
  "PassedFiles": [],
  "Disable": {
    "EndOfLine": false,
    "Indentation": false,
    "InsertFinalNewline": false,
    "TrimTrailingWhitespace": false,
    "IndentSize": false,
    "MaxLineLength": false
  }
}
