{
    "$schema": "./.editorconfig-checker.schema.json",
    "Verbose": false,
    "Debug": false,
    "IgnoreDefaults": false,
    "SpacesAfterTabs": false,
    "NoColor": false,
    "Exclude": [
        "testfiles",
        "testdata"
    ],
    "AllowedContentTypes": [],
    "PassedFiles": [],
    "Disable": {
        "Charset": false,
        "EndOfLine": false,
        "Indentation": false,
        "InsertFinalNewline": false,
        "TrimTrailingWhitespace": false,
        "IndentSize": false,
        "MaxLineLength": false
    }
}
